Name,Category,Difficulty,Estimated Time,Ideal Stage,Short Description,Long Description,Brief Instructions Step 1,Brief Instructions Step 2,Brief Instructions Step 3,Detailed Instructions Step 1,Detailed Instructions Step 2,Detailed Instructions Step 3,Detailed Instructions Step 4,Detailed Instructions Step 5,General Tips,Troubleshooting,Prerequisites,Progressions,Preparation Tips,Training Insights,Achievement Level 1,Achievement Level 2,Achievement Level 3,Ideal Stage Level 1,Ideal Stage Level 2,Ideal Stage Level 3,Pass Criteria,Fail Criteria,Mastery Criteria
Nicely (Polite Loose-Leash Walking Cue),Foundational / Leash Manners,Beginner–Intermediate,2–4 weeks,"Level 1 by Week 12, Level 2 by Week 16, Level 3 by Week 20",Teaches the dog to walk politely without pulling.,"The 'Nicely' cue helps your dog understand that pulling on the leash is not allowed and that staying near you with light leash tension is rewarding. This cue improves comfort, safety, and communication during everyday walks.",Say 'Nicely.',Reward loose-leash moments.,Stop when dog pulls.,"Begin walking in a quiet area. When the leash is loose, say 'Nicely' in a calm tone and reward your dog for staying close.","If your dog begins to pull, stop walking immediately. Wait for the leash to loosen or for your dog to check in, then mark and reward.",Practice stopping and starting consistently so your dog learns that pulling ends the walk but polite walking keeps it going.,,,Reward often during early stages. Keep sessions short to avoid frustration. Use gentle movements and avoid jerking the leash.,"If your dog pulls constantly, move to a quieter area. If they become frustrated, use higher-value treats. If they lag behind, encourage with a happy voice.",Name Recognition,"Heel, Focused Walking, Recall","Use a well-fitted harness and treats, and choose a quiet area to begin.",Loose-leash walking develops better communication and makes outdoor experiences enjoyable rather than stressful.,Walks politely indoors or on driveway.,Maintains loose leash in yard or quiet streets.,Walks nicely in high-distraction areas.,Week 12,Week 16,Week 20,Dog keeps leash loose.,Dog consistently pulls.,Dog walks politely in all environments with minimal cues.
Look (Watch Me / Focus),Foundational / Focus / Engagement,Beginner,1–2 weeks,"Level 1 by Week 6, Level 2 by Week 8, Level 3 by Week 10",Teaches the dog to make eye contact on cue.,"The Look cue improves your dog’s focus and engagement. It helps redirect attention away from distractions and strengthens communication, making all other training easier and more effective.",Say 'Look.',Mark eye contact.,Reward quickly.,"Begin in a quiet environment. Hold a treat near your face and say 'Look.' When your dog makes eye contact, mark and reward.",Gradually remove the lure by using an empty hand signal.,"Practice in new rooms, then the yard, and eventually outdoors. Increase difficulty by adding mild distractions.",,,Reward immediately at first to build clear understanding. Keep training sessions short and fun. Use a cheerful tone.,"If your dog avoids eye contact, hold the treat closer to your face. If they look away frequently, reduce distractions. If they stare at the treat instead of your eyes, hide the treat behind your back and reward afterward.",Name Recognition,"Heel, Recall, Impulse-Control Exercises",Use soft treats and begin in a calm indoor space.,Eye contact builds strong communication and is essential for managing distractions in real-life environments.,Makes eye contact indoors.,Maintains eye contact around mild distractions.,Maintains eye contact in busy environments.,Week 6,Week 8,Week 10,Dog looks at you on cue.,Dog avoids eye contact.,Dog offers automatic check-ins even without cue.
Release Command (Okay),Foundational / Communication,Beginner,1 week,"Level 1 by Week 6, Level 2 by Week 8, Level 3 by Week 10",Teaches the dog that a behaviour or position is finished and they are free to move.,"The Release cue is essential for clear communication. It tells your dog when a command such as Sit, Down, Stay, or Mat is complete, preventing confusion and teaching your dog to hold positions until they hear the release word.",Ask for position.,Pause briefly.,Say release word.,Begin by asking your dog to sit or lie down. Hold the position for one or two seconds.,"Say your release cue—such as 'Okay!'—in an upbeat tone, then encourage your dog to move.",Reward them after they move to reinforce that the release word means the exercise is finished.,,,Use the release word consistently and only when you truly intend to end the behaviour. Avoid using it casually in conversation.,"If your dog breaks positions early, reduce duration. If they seem confused, practice very short holds before releasing. If they ignore the release, increase your enthusiasm.","Sit, Down, Stay","Extended Stays, Mat Work, Duration Behaviours","Choose a clear, simple release word and prepare small treats.",The Release cue creates structure and prevents your dog from guessing when an exercise is finished.,Understands release indoors.,Holds position until release with mild distractions.,Holds position in public until released.,Week 6,Week 8,Week 10,Dog waits for release.,Dog breaks command early.,Dog holds commands until release in all environments.
Stand,Foundational / Obedience / Grooming Prep,Beginner–Intermediate,1–3 weeks,"Level 1 by Week 10, Level 2 by Week 12, Level 3 by Week 14",Teaches the dog to rise into a standing position and remain still.,"Stand is extremely useful for grooming, vet visits, wiping paws, and body handling. It also improves body awareness and supports advanced obedience positions used in sports or precision heelwork.",Lure forward.,Mark when standing.,Add cue.,"Start with your dog in a sit or down. Hold a treat in front of their nose and slowly move it forward. As they rise into a stand, mark and reward immediately.","Once they perform the behaviour reliably, add the verbal cue 'Stand' before luring.","Build duration by rewarding your dog for staying in the stand position for a few seconds, then gradually increasing the duration.",,,Reward calm stillness. Avoid luring too quickly or too high. Keep the dog’s posture straight by rewarding close to their chest.,"If your dog steps forward instead of standing in place, lure more slowly. If they keep sitting again, give shorter duration requests. If they seem confused, practice from a down position instead.","Sit, Down","Grooming Handling, Veterinary Cooperative Care, Precision Obedience",Use treats and practice on a non-slip surface.,Stand builds confidence and teaches your dog to remain stable during handling.,Stands briefly indoors.,Holds stand with mild distractions.,Holds stand during grooming or vet handling.,Week 10,Week 12,Week 14,Dog transitions into stand on cue.,Dog sits or lies down instead.,Dog holds stand confidently during real handling.
Place (Go to Place),Foundational / Calmness / Management,Intermediate,2–4 weeks,"Level 1 by Week 12, Level 2 by Week 14, Level 3 by Week 16",Teaches the dog to go to a defined spot and remain there until released.,"Place training provides your dog with a clear job and a designated relaxation location. It helps reduce overexcitement, supports polite behaviour during meals or guest arrivals, and provides structure for dogs who struggle to settle.",Lure dog onto place.,Mark and reward.,Add cue and duration.,"Begin by showing your dog the place item (mat, bed, platform). Lure them onto it and mark the moment all four paws touch the surface. Reward immediately.","Repeat until consistent, then add the cue 'Place' right before luring.",Begin adding duration by rewarding your dog for remaining on the place for increasing amounts of time.,"Gradually add distractions, distance, and real-life applications (mealtime, door knocking).",,Reward frequently at first to build a strong positive association. Use Place during natural downtime such as meals or relaxing.,"If your dog steps off the place, calmly reset them. If they hesitate to go on, use higher-value treats. If they break frequently, reduce distractions.","Sit, Down","Stay, Settle, Public Calmness",Choose a clearly defined Place surface and have treats ready.,Place training is one of the strongest calmness-building tools for dogs with high energy or anxiety.,Goes to place indoors.,Holds place with distractions.,Uses place reliably in public settings.,Week 12,Week 14,Week 16,Dog goes to place promptly.,Dog leaves place before release.,Dog remains calmly on place in busy real-life scenarios.
Drop It,Foundational / Safety / Impulse Control,Beginner–Intermediate,1–3 weeks,"Level 1 by Week 10, Level 2 by Week 12, Level 3 by Week 14",Teaches the dog to release an item from their mouth.,"Drop It is essential for safety and prevents guarding or dangerous object ingestion. Teaching your dog to willingly release objects builds trust, reduces conflict, and allows for safe play with toys.",Trade toy for treat.,Add cue.,Practice with different items.,"Begin with a toy your dog enjoys but is not overly obsessed with. Offer a treat near their nose; when they drop the toy to take the treat, mark and reward.",Add the cue 'Drop It' right before presenting the treat.,"Practice with different toys, increasing difficulty gradually. Never chase your dog for items, as this builds possessiveness.",,,"Always trade politely. Avoid pulling items from your dog’s mouth. Use calm, consistent cues and reward generously.","If your dog runs away with items, use lower-value toys. If they refuse to drop, increase reward value. If they guard objects, practice with safe, non-valued items first.","Take It, Fetch (Optional)","Retrieve Games, Impulse Control, Leave It",Use two toys or high-value treats for trading.,Drop It strengthens trust and prevents unwanted or dangerous object swallowing.,Drops low-value items.,Drops toys during play.,Drops high-value items or food distractions.,Week 10,Week 12,Week 14,Dog releases object promptly.,Dog refuses or guards.,"Dog drops anything on cue, even under excitement."
Fetch,Fun / Play / Exercise,Beginner–Intermediate,2–4 weeks,"Level 1 by Week 12, Level 2 by Week 14, Level 3 by Week 16",Teaches the dog to retrieve an item and bring it back.,"Fetch builds physical exercise, mental stimulation, and teamwork between you and your dog. It can help strengthen recall, reduce boredom, and provide structured play for high-energy dogs.",Encourage chase.,Reward returns.,Add structure.,Begin by tossing a toy a short distance. Encourage your dog to chase it.,"When they return with the toy, reward them immediately, even if they do not deliver it perfectly. This builds motivation to return.",Add structure by asking for Drop It before throwing again. Keep sessions short to maintain excitement.,,,Use toys your dog loves. Keep throws short at first. Always reward the return to reinforce the fetch cycle.,"If your dog runs away with the toy, use two-toy games. If they won’t chase, increase excitement. If they drop the toy too early, reward closer and build distance gradually.","Take It, Drop It","Retrieve Sports, Agility Motivation, Recall Reinforcement",Choose a safe toy and open space with minimal distractions.,Fetch should always feel exciting and rewarding to keep motivation high.,Retrieves toy indoors.,Retrieves toy outdoors.,Retrieves reliably in distracting environments.,Week 12,Week 14,Week 16,Dog brings toy back.,Dog loses interest.,Dog performs reliable fetch with structured Drop It.
Take It,Foundational / Play / Impulse Control,Beginner,1–2 weeks,"Level 1 by Week 8, Level 2 by Week 10, Level 3 by Week 12",Teaches the dog to take an object gently on cue.,"Take It teaches your dog to wait for permission before taking food or toys. This improves impulse control, prevents grabbing, and teaches polite manners around hands and objects.",Hold object.,Say 'Take It.',Allow gentle mouth contact.,"Hold a toy or treat in your hand while keeping your fist closed. When your dog waits calmly, say 'Take It' and open your hand.",Reward gentle taking by marking and praising.,Gradually introduce more exciting items while reinforcing calmness.,,,Never allow grabbing or lunging. Reward calm waiting before giving the cue.,"If your dog grabs too hard, use less exciting items. If they grab early, close your hand quickly. If they seem confused, slow down and reward small steps.","Sit, Name Recognition","Drop It, Fetch, Object Handling",Choose a low-excitement item at first and use calm handling.,Take It teaches impulse control and sets the foundation for polite use of toys or treats.,Takes object gently indoors.,Takes object around mild distractions.,Takes objects gently in exciting play situations.,Week 8,Week 10,Week 12,Dog waits calmly for cue.,Dog grabs early.,Dog takes any object gently on cue.
Roll Over,Fun / Obedience / Body Awareness,Intermediate,2–4 weeks,"Level 1 by Week 14, Level 2 by Week 16, Level 3 by Week 18",Teaches the dog to roll onto their back and complete a full rotation.,"Roll Over is a fun trick that improves flexibility, confidence, and comfort with body handling. It helps dogs become at ease with unusual positions and strengthens overall body awareness.",Lure your dog into a down.,Lure their head toward their shoulder.,Guide them through a full roll.,Ask your dog to lie down on a soft surface. Hold a treat by their nose and slowly lure their head toward their shoulder so they begin to roll onto their side.,Continue moving the treat in a circular motion so your dog rolls onto their back and then completes the rotation onto their other side.,"Mark and reward as soon as they finish the roll. Practice in short, positive sessions, rewarding even partial rolls at first.",,,"Train on a soft, non-slip surface so your dog feels comfortable. Move the lure slowly and clearly so they can follow it. Reward attempts generously at the beginning.","If your dog pops up instead of rolling, slow your hand movement and keep it close to their nose. If they resist rolling fully, reward for smaller movements like shifting onto their side and gradually build up. If they seem uncomfortable, try a softer surface or end the session and try again later.",Down,"Advanced Tricks, Body Awareness Games, Cooperative Handling",Use a soft mat or carpeted area and prepare high-value treats. Make sure your dog is relaxed and not overly excited before starting.,"Roll Over helps dogs become more comfortable with touch and handling, which can make grooming and vet care less stressful over time.",Performs a full roll with a clear lure indoors.,Performs a roll with minimal luring and light distractions.,Performs a roll on verbal cue alone in a variety of environments.,Week 14,Week 16,Week 18,Dog completes a full roll with your guidance.,Dog repeatedly pops up or refuses to roll.,"Dog rolls smoothly on a single cue without needing a hand lure, even in new places."
Touch (Hand Target),Foundational / Focus / Engagement,Beginner,1–2 weeks,"Level 1 by Week 6, Level 2 by Week 8, Level 3 by Week 10",Teaches the dog to touch your hand with their nose.,"Touch is a simple but powerful focus exercise that encourages your dog to interact with you. It can be used to redirect attention, build confidence, move your dog into position, and form the basis for many more complex tricks.",Present your hand.,Mark when your dog touches it.,Add the verbal cue.,"In a quiet room, hold your open hand a few centimetres from your dog’s nose. The moment they reach forward and touch your hand with their nose, mark and reward.",Repeat this several times until your dog is consistently touching your hand. Then begin saying 'Touch' just before presenting your hand.,"Once your dog understands, start varying the position of your hand (slightly higher, lower, or to the side) to help them generalize the behaviour.",,,Keep your hand close at first to make success easy. Use a happy voice and reward every touch during the early stages. Keep sessions short so your dog stays engaged.,"If your dog seems unsure and does not approach your hand, move it closer to their nose and wait patiently. If they lick or mouth your hand instead of touching gently, flatten your hand and reward only light touches. If they lose focus easily, reduce distractions and use higher-value treats.",Name Recognition,"Heel Engagement, Spin, Redirecting Arousal, Target-Based Tricks",Have small soft treats ready and choose a calm indoor space so your dog can concentrate.,"Touch is an excellent way to build engagement with shy or easily distracted dogs because it gives them a clear, simple job to succeed at.",Touches your hand reliably indoors with minimal distraction.,Can perform Touch in different rooms or the yard with some distractions.,Responds to the Touch cue in busy environments like parks or training classes.,Week 6,Week 8,Week 10,Dog touches your hand promptly when cued.,Dog avoids your hand or seems confused after several attempts.,Dog can target your hand confidently in any environment and in a variety of positions.
High Five,Fun / Trick / Confidence,Beginner,1–2 weeks,"Level 1 by Week 10, Level 2 by Week 12, Level 3 by Week 14",Teaches the dog to raise a paw and tap your open hand.,High Five is a fun party trick that builds your dog’s confidence and comfort with having their paws handled. It can also be a stepping stone to other paw-based behaviours such as Wave or Shake.,Ask your dog to sit.,Present your open hand.,Reward when their paw touches your hand.,"Start with your dog in a sit. Hold your open palm a few centimetres in front of their chest. Many dogs will naturally lift a paw to investigate; as soon as their paw touches your hand, mark and reward.","If they do not offer a paw, you can first encourage pawing by holding a treat in your closed fist and rewarding for paw contact, then switch to the open palm once they understand.","When your dog is reliably touching your palm, add the cue 'High Five' just before you present your hand.",,,"Reward small efforts early on, such as tiny paw lifts. Keep your hand steady and at a comfortable height. Train on a non-slip surface so your dog feels secure.","If your dog tries to use their mouth instead of their paw, raise your hand slightly higher and only reward paw contact. If they swipe too hard, calmly withdraw your hand and reward calmer touches. If they seem confused, go back to rewarding simple paw lifts and build up again.",Sit,"Wave, Shake, Hug, Other Paw Tricks","Prepare small treats and work on a stable, non-slippery floor surface.",High Five encourages your dog to offer behaviours confidently and can make them more relaxed about having their paws handled during grooming or vet visits.,Offers a paw to your palm indoors with minimal distraction.,Performs a clear High Five with moderate distractions present.,Can High Five on cue in new environments and around other people.,Week 10,Week 12,Week 14,Dog taps your open palm with their paw when cued.,Dog avoids using their paw or becomes frustrated.,"Dog offers a calm, controlled High Five in a variety of situations and with different people."
Nose (Boop),Fun / Trick / Targeting,Beginner,1–2 weeks,"Level 1 by Week 6, Level 2 by Week 8, Level 3 by Week 10","Teaches the dog to gently tap a hand, finger, or small object with their nose.","Nose Boop is a cute targeting trick that also helps build precision and confidence. It can later be used in more advanced tasks like object targeting, pushing buttons, or interactive games.",Present a small target.,Mark when your dog boops it with their nose.,Add the verbal cue.,"Hold your hand, a finger, or a small target object a few centimetres from your dog’s nose. When they move forward and make contact with their nose, mark and reward immediately.","Repeat several times until your dog is reliably booping the target, then begin saying 'Boop' just before presenting it.","Once they understand, start to slowly vary the position of the target (slightly higher, lower, or to the side) to generalize the behaviour.",,,"Keep the target very close at first so the behaviour feels easy. Reward frequently to keep the dog motivated. Use calm, clear body language.","If your dog mouths or bites at the target, pause briefly and only reward gentle nose touches. If they ignore the target, use a larger, more obvious target such as your open hand before progressing to smaller objects. If they become distracted, reduce environmental stimulation.",Touch (Hand Target),"Object Targeting, Button Pushing, Send-Away Targeting",Choose a clear target (such as your hand or a small object) and prepare several small treats. Start in a quiet area.,Nose Boop is a great stepping stone into more complex targeting behaviours and gives nervous dogs a simple way to succeed.,Boops a target that is held very close in a quiet room.,Boops targets presented at different angles or positions with some distractions.,Boops small targets on cue in new or busy environments.,Week 6,Week 8,Week 10,Dog touches the target with their nose when cued.,Dog consistently avoids or mouths the target.,Dog confidently boops a variety of targets on cue in many different environments.
Bow,Fun / Trick / Body Awareness,Beginner–Intermediate,2–3 weeks,"Level 1 by Week 12, Level 2 by Week 14, Level 3 by Week 16",Teaches the dog to lower their front end while keeping hind legs standing.,"Bow improves flexibility, builds body awareness, and encourages confident stretching. It is a visually appealing trick and helps dogs become more comfortable with controlled posture changes.",Lure chest down.,Reward bow.,Add cue.,Start with your dog standing. Hold a treat near their nose and slowly lure their head downward and slightly forward so their chest lowers while their hind end stays up.,"Mark and reward the instant they hold the bow shape, even briefly.","When your dog consistently performs the motion, add the cue 'Bow' just before you begin luring.",,,"Use slow, smooth luring. Reward even partial bows. Train on a soft surface.","If the dog collapses into a down, lure slightly forward instead of straight down. If stiff, keep sessions short. If they seem confused, shape small movements first.",Stand,"Advanced Tricks, Stretch Exercises",Use a non-slip surface and medium-value treats.,Bow helps dogs learn precise body positioning and encourages healthy stretching habits.,Performs bow with lure.,Performs bow on cue.,Performs bow with distractions in new environments.,Week 12,Week 14,Week 16,Dog holds bow briefly.,Dog lies down or avoids.,Smooth controlled bow on cue anywhere.
Hug,Fun / Trick / Bonding,Intermediate,3–5 weeks,"Level 1 by Week 14, Level 2 by Week 18, Level 3 by Week 20",Teaches the dog to wrap their paws around an object or your arm.,"Hug is a cute bonding trick that helps dogs build confidence and controlled use of their paws. It can be taught using a stuffed toy first, then transferred to your arm.",Encourage paw lift.,Shape wrap-around.,Add cue.,"With your dog sitting, hold a stuffed toy or pillow close to their chest and reward any attempt to lift a paw toward it.",Gradually shape the behaviour until your dog wraps one or both paws around the object. Mark and reward every improvement.,Add the cue 'Hug' once your dog reliably performs the wrap.,,,Reward small steps. Avoid encouraging jumping. Keep sessions short.,"If your dog jumps up instead of hugging, reset by asking for sit. If unsure, use a familiar object. If stuck, break the movement into tiny shaping steps.","Sit, High Five","Pose Tricks, Confidence Tricks",Use a stuffed toy or pillow and high-value treats.,"Hug encourages controlled, gentle body contact and builds emotional connection.",Wraps paws with lure.,Wraps paws on cue.,Holds hug for several seconds in new settings.,Week 14,Week 18,Week 20,Dog places paws around object.,Dog jumps or avoids.,"Dog performs gentle, controlled hug on cue."
Hide (Hide Face / Shy),Fun / Trick / Body Awareness,Intermediate,3–6 weeks,"Level 1 by Week 14, Level 2 by Week 18, Level 3 by Week 20",Teaches the dog to cover their nose or face with their paw.,Hide is an adorable trick that improves paw awareness and confidence. It’s usually taught using a small piece of tape or sticker to prompt a natural paw swipe toward the face.,Prompt paw lift.,Shape face touch.,Add cue.,Place a small safe piece of tape lightly on your dog’s nose so they naturally lift a paw to swipe it off. Mark and reward when their paw touches their face.,Gradually shape the behaviour so they touch their nose without the tape. Reward small improvements.,Add the cue 'Hide' once the behaviour is reliable.,,,Use very light tape and limit use to a few repetitions. Reward instantly.,"If the dog gets irritated, remove tape promptly and reduce difficulty. If they swipe too hard, reduce excitement. If confused, reward tiny paw lifts and build gradually.","High Five, Paw Awareness","Advanced Tricks, Theatrical Tricks",Have soft treats and small pieces of safe tape ready.,Hide helps dogs learn fine motor control with their paws and is great for shaping complex behaviours.,Touches face with tape prompt.,Touches face on cue.,Performs hide anywhere reliably.,Week 14,Week 18,Week 20,Dog briefly covers nose.,Dog avoids behaviour.,"Smooth, cue-only face cover in different environments."
